{
  "expectation_schema_version": "1",
  "canonical_schema_version": "1.1",
  "account": {
    "id": null,
    "iban": null,
    "currency": "GBP"
  },
  "statement": {
    "id": null,
    "sequence": null,
    "start_date": "2026-10-01",
    "end_date": "2026-10-02",
    "opening_balance": null,
    "closing_balance": null,
    "opening_balance_currency": null,
    "closing_balance_currency": null
  },
  "transactions": [
    {
      "booking_date": "2026-10-01",
      "value_date": null,
      "amount": "-4.00",
      "currency": "GBP",
      "description": "First line\nsecond line",
      "counterparty": {
        "name": null,
        "account_id": null,
        "iban": null
      },
      "reference": null,
      "transaction_id": null
    },
    {
      "booking_date": "2026-10-02",
      "value_date": null,
      "amount": "2.00",
      "currency": "GBP",
      "description": "Refund",
      "counterparty": {
        "name": null,
        "account_id": null,
        "iban": null
      },
      "reference": null,
      "transaction_id": null
    }
  ]
}
